[
  {
    "id": "weidian-7632057229",
    "title": "Running shoes 1",
    "category": "Shoes",
    "subcategory": "Sneakers",
    "brand": "Not specified",
    "marketplace": "Weidian",
    "priceCny": 338.0,
    "image": "/assets/products/weidian/7632057229.gif",
    "sourceUrl": "https://weidian.com/item.html?itemID=7632057229",
    "detailUrl": "/en/finds/weidian-7632057229/",
    "tags": [
      "Sneakers",
      "Weidian shop 1663319819"
    ],
    "qcNotes": [
      "Ask for size-label and insole measurements for the selected size.",
      "Check both shoes, outsole edges and stitching in QC photos."
    ],
    "shippingNotes": [
      "Ask for packed weight and dimensions with and without the shoe box before comparing shipping quotes."
    ],
    "updatedAt": "2026-09-10",
    "isIndexable": false,
    "sourceType": "commercial",
    "isPlaceholder": false,
    "featured": true,
    "imageAlt": "Running shoes 1 — seller product photo",
    "description": "Seller listing from Weidian shop 1663319819. Original listing title: 高品跑鞋1. The saved price may depend on the selected option. Confirm specifications and current availability at the source; this listing has not been independently QC tested.",
    "sourceName": "Weidian · 夕阳的刻痕 (1663319819)"
  },
  {
    "id": "weidian-7632169241",
    "title": "LXD zip-neck knitted sweater",
    "category": "Clothing",
    "subcategory": "Tops",
    "brand": "Not specified",
    "marketplace": "Weidian",
    "priceCny": 165.0,
    "image": "/assets/products/weidian/7632169241.jpg",
    "sourceUrl": "https://weidian.com/item.html?itemID=7632169241",
    "detailUrl": "/en/finds/weidian-7632169241/",
    "tags": [
      "Tops",
      "Weidian shop 1663319819"
    ],
    "qcNotes": [
      "Compare chest, length and sleeve measurements with clothing you already own.",
      "Check seams, closures and the selected color in QC photos."
    ],
    "shippingNotes": [
      "Request packed weight for your selected quantity; bulky layers can increase parcel volume."
    ],
    "updatedAt": "2026-09-10",
    "isIndexable": false,
    "sourceType": "commercial",
    "isPlaceholder": false,
    "featured": true,
    "imageAlt": "LXD zip-neck knitted sweater — seller product photo",
    "description": "Seller listing from Weidian shop 1663319819. Original listing title: LXD-拉链开胸立领针织毛衣. The saved price may depend on the selected option. Confirm specifications and current availability at the source; this listing has not been independently QC tested.",
    "sourceName": "Weidian · 夕阳的刻痕 (1663319819)"
  },
  {
    "id": "weidian-7632217737",
    "title": "Outdoor casual sports shoes 70",
    "category": "Shoes",
    "subcategory": "Sneakers",
    "brand": "Not specified",
    "marketplace": "Weidian",
    "priceCny": 385.0,
    "image": "/assets/products/weidian/7632217737.png",
    "sourceUrl": "https://weidian.com/item.html?itemID=7632217737",
    "detailUrl": "/en/finds/weidian-7632217737/",
    "tags": [
      "Sneakers",
      "Weidian shop 1663319819"
    ],
    "qcNotes": [
      "Ask for size-label and insole measurements for the selected size.",
      "Check both shoes, outsole edges and stitching in QC photos."
    ],
    "shippingNotes": [
      "Ask for packed weight and dimensions with and without the shoe box before comparing shipping quotes."
    ],
    "updatedAt": "2026-09-10",
    "isIndexable": false,
    "sourceType": "commercial",
    "isPlaceholder": false,
    "featured": true,
    "imageAlt": "Outdoor casual sports shoes 70 — seller product photo",
    "description": "Seller listing from Weidian shop 1663319819. Original listing title: TOP品质户外时尚休闲运动鞋-70. The saved price may depend on the selected option. Confirm specifications and current availability at the source; this listing has not been independently QC tested.",
    "sourceName": "Weidian · 夕阳的刻痕 (1663319819)"
  },
  {
    "id": "weidian-7632057227",
    "title": "Couple sweatshirt",
    "category": "Clothing",
    "subcategory": "Tops",
    "brand": "Not specified",
    "marketplace": "Weidian",
    "priceCny": 167.0,
    "image": "/assets/products/weidian/7632057227.jpg",
    "sourceUrl": "https://weidian.com/item.html?itemID=7632057227",
    "detailUrl": "/en/finds/weidian-7632057227/",
    "tags": [
      "Tops",
      "Weidian shop 1663319819"
    ],
    "qcNotes": [
      "Compare chest, length and sleeve measurements with clothing you already own.",
      "Check seams, closures and the selected color in QC photos."
    ],
    "shippingNotes": [
      "Request packed weight for your selected quantity; bulky layers can increase parcel volume."
    ],
    "updatedAt": "2026-09-10",
    "isIndexable": false,
    "sourceType": "commercial",
    "isPlaceholder": false,
    "featured": true,
    "imageAlt": "Couple sweatshirt — seller product photo",
    "description": "Seller listing from Weidian shop 1663319819. Original listing title: Fashion Couple Sweatshirt(off 15%). The saved price may depend on the selected option. Confirm specifications and current availability at the source; this listing has not been independently QC tested.",
    "sourceName": "Weidian · 夕阳的刻痕 (1663319819)"
  },
  {
    "id": "weidian-7635193722",
    "title": "Summer shorts SQ002",
    "category": "Clothing",
    "subcategory": "Bottoms",
    "brand": "Not specified",
    "marketplace": "Weidian",
    "priceCny": 207.0,
    "image": "/assets/products/weidian/7635193722.jpg",
    "sourceUrl": "https://weidian.com/item.html?itemID=7635193722",
    "detailUrl": "/en/finds/weidian-7635193722/",
    "tags": [
      "Bottoms",
      "Weidian shop 1663319819"
    ],
    "qcNotes": [
      "Compare chest, length and sleeve measurements with clothing you already own.",
      "Check seams, closures and the selected color in QC photos."
    ],
    "shippingNotes": [
      "Request packed weight for your selected quantity; bulky layers can increase parcel volume."
    ],
    "updatedAt": "2026-09-10",
    "isIndexable": false,
    "sourceType": "commercial",
    "isPlaceholder": false,
    "featured": true,
    "imageAlt": "Summer shorts SQ002 — seller product photo",
    "description": "Seller listing from Weidian shop 1663319819. Original listing title: 夏季1流 shorts hot27-SQ002ph. The saved price may depend on the selected option. Confirm specifications and current availability at the source; this listing has not been independently QC tested.",
    "sourceName": "Weidian · 夕阳的刻痕 (1663319819)"
  },
  {
    "id": "weidian-7632171167",
    "title": "Crew-neck sweatshirt 006",
    "category": "Clothing",
    "subcategory": "Tops",
    "brand": "Not specified",
    "marketplace": "Weidian",
    "priceCny": 250.0,
    "image": "/assets/products/weidian/7632171167.jpg",
    "sourceUrl": "https://weidian.com/item.html?itemID=7632171167",
    "detailUrl": "/en/finds/weidian-7632171167/",
    "tags": [
      "Tops",
      "Weidian shop 1663319819"
    ],
    "qcNotes": [
      "Compare chest, length and sleeve measurements with clothing you already own.",
      "Check seams, closures and the selected color in QC photos."
    ],
    "shippingNotes": [
      "Request packed weight for your selected quantity; bulky layers can increase parcel volume."
    ],
    "updatedAt": "2026-09-10",
    "isIndexable": false,
    "sourceType": "commercial",
    "isPlaceholder": false,
    "featured": true,
    "imageAlt": "Crew-neck sweatshirt 006 — seller product photo",
    "description": "Seller listing from Weidian shop 1663319819. Original listing title: 经典时尚圆领卫衣-006. The saved price may depend on the selected option. Confirm specifications and current availability at the source; this listing has not been independently QC tested.",
    "sourceName": "Weidian · 夕阳的刻痕 (1663319819)"
  },
  {
    "id": "weidian-7635115516",
    "title": "Autumn sweater",
    "category": "Clothing",
    "subcategory": "Tops",
    "brand": "Not specified",
    "marketplace": "Weidian",
    "priceCny": 387.0,
    "image": "/assets/products/weidian/7635115516.jpg",
    "sourceUrl": "https://weidian.com/item.html?itemID=7635115516",
    "detailUrl": "/en/finds/weidian-7635115516/",
    "tags": [
      "Tops",
      "Weidian shop 1663319819"
    ],
    "qcNotes": [
      "Compare chest, length and sleeve measurements with clothing you already own.",
      "Check seams, closures and the selected color in QC photos."
    ],
    "shippingNotes": [
      "Request packed weight for your selected quantity; bulky layers can increase parcel volume."
    ],
    "updatedAt": "2026-09-10",
    "isIndexable": false,
    "sourceType": "commercial",
    "isPlaceholder": false,
    "featured": true,
    "imageAlt": "Autumn sweater — seller product photo",
    "description": "Seller listing from Weidian shop 1663319819. Original listing title: 秋季时尚潮流毛衣. The saved price may depend on the selected option. Confirm specifications and current availability at the source; this listing has not been independently QC tested.",
    "sourceName": "Weidian · 夕阳的刻痕 (1663319819)"
  },
  {
    "id": "weidian-7632217731",
    "title": "Casual hooded sweatshirt",
    "category": "Clothing",
    "subcategory": "Hoodies",
    "brand": "Not specified",
    "marketplace": "Weidian",
    "priceCny": 425.0,
    "image": "/assets/products/weidian/7632217731.jpg",
    "sourceUrl": "https://weidian.com/item.html?itemID=7632217731",
    "detailUrl": "/en/finds/weidian-7632217731/",
    "tags": [
      "Hoodies",
      "Weidian shop 1663319819"
    ],
    "qcNotes": [
      "Compare chest, length and sleeve measurements with clothing you already own.",
      "Check seams, closures and the selected color in QC photos."
    ],
    "shippingNotes": [
      "Request packed weight for your selected quantity; bulky layers can increase parcel volume."
    ],
    "updatedAt": "2026-09-10",
    "isIndexable": false,
    "sourceType": "commercial",
    "isPlaceholder": false,
    "featured": true,